Question,Difficulty,Ground Truth SQL,Basic Predicted SQL,Advanced Predicted SQL,EX Basic,EX Advanced
"Consider the average difference between K-12 enrollment and 15-17 enrollment of schools that are locally funded, list the names and DOC type of schools which has a difference above this average.",challenging,"SELECT T2.School, T2.DOC FROM frpm AS T1 INNER JOIN schools AS T2 ON T1.CDSCode = T2.CDSCode WHERE T2.FundingType = 'Locally funded' AND (T1.`Enrollment (K-12)` - T1.`Enrollment (Ages 5-17)`) > (SELECT AVG(T3.`Enrollment (K-12)` - T3.`Enrollment (Ages 5-17)`) FROM frpm AS T3 INNER JOIN schools AS T4 ON T3.CDSCode = T4.CDSCode WHERE T4.FundingType = 'Locally funded')","SELECT schools.school, schools.doc FROM schools JOIN frpm ON schools.cdscode = frpm.cdscode WHERE schools.fundingtype = 'Local' AND (frpm.enrollment (k-12) - frpm.enrollment (ages 5-17)) > (   SELECT AVG(frpm.enrollment (k-12) - frpm.enrollment (ages 5-17))   FROM frpm   JOIN schools ON frpm.cdscode = schools.cdscode   WHERE schools.fundingtype = 'Local' ) ORDER BY schools.school","SELECT T2.School, T2.DOC FROM frpm AS T1 INNER JOIN schools AS T2 ON T1.CDSCode = T2.CDSCode WHERE T2.FundingType = 'Locally funded' AND (T1.`Enrollment (K-12)` - T1.`Enrollment (Ages 5-17)`) > (SELECT AVG(T3.`Enrollment (K-12)` - T3.`Enrollment (Ages 5-17)`) FROM frpm AS T3 INNER JOIN schools AS T4 ON T3.CDSCode = T4.CDSCode WHERE T4.FundingType = 'Locally funded')",0,1
Under whose administration is the school with the highest number of students scoring 1500 or more on the SAT? Indicate their full names.,challenging,"SELECT T2.AdmFName1, T2.AdmLName1, T2.AdmFName2, T2.AdmLName2, T2.AdmFName3, T2.AdmLName3 FROM satscores AS T1 INNER JOIN schools AS T2 ON T1.cds = T2.CDSCode ORDER BY T1.NumGE1500 DESC LIMIT 1",NULL,"SELECT T2.AdmFName1, T2.AdmLName1, T2.AdmFName2, T2.AdmLName2, T2.AdmFName3, T2.AdmLName3 FROM frpm AS T1 INNER JOIN schools AS T2 ON T1.CDSCode = T2.CDSCode INNER JOIN satscores AS T3 ON T1.CDSCode = T3.CDS WHERE T3.NumGE1500 >= 1500 ORDER BY T1.`Enrollment (K-12)` DESC LIMIT 1",0,0
What is the total number of non-chartered schools in the county of Los Angeles with a percent (%) of eligible free meals for grades 1 through 12 that is less than 0.18%?,challenging,SELECT COUNT(T2.School) FROM frpm AS T1 INNER JOIN schools AS T2 ON T1.CDSCode = T2.CDSCode WHERE T2.County = 'Los Angeles' AND T2.Charter = 0 AND CAST(T1.`Free Meal Count (K-12)` AS REAL) * 100 / T1.`Enrollment (K-12)` < 0.18,SELECT COUNT(*) FROM schools WHERE county = 'Los Angeles' AND percent_eligible_free_meals_k_12 < 0.18 AND charter = 0,SELECT COUNT(T2.School) FROM frpm AS T1 INNER JOIN schools AS T2 ON T1.CDSCode = T2.CDSCode WHERE T2.County = 'Los Angeles' AND T2.Charter = 0 AND CAST(T1.`Free Meal Count (K-12)` AS REAL) * 100 / T1.`Enrollment (K-12)` < 0.18,0,1
"Of the schools that offers a magnet program serving a grade span of Kindergarten to 8th grade, how many offers Multiple Provision Types? List the number of cities that offers a Kindergarten to 8th grade span and indicate how many schools are there serving such grade span for each city.",challenging,"SELECT T2.City, COUNT(T2.CDSCode) FROM frpm AS T1 INNER JOIN schools AS T2 ON T1.CDSCode = T2.CDSCode WHERE T2.Magnet = 1 AND T2.GSoffered = 'K-8' AND T1.`NSLP Provision Status` = 'Multiple Provision Types' GROUP BY T2.City","SELECT COUNT(DISTINCT city) AS num_cities,        SUM(CASE WHEN gsserved LIKE '%K%' AND gsserved LIKE '%8%' THEN 1 ELSE 0 END) AS num_schools FROM schools WHERE Magnet = 1 AND gsserved LIKE '%K%' AND gsserved LIKE '%8%' GROUP BY city","SELECT T2.City, COUNT(T2.School) FROM frpm AS T1 INNER JOIN schools AS T2 ON T1.CDSCode = T2.CDSCode WHERE T2.Magnet = 1 AND T2.GSServed = 'K-8' AND T1.`NSLP Provision Status` = 'Multiple Provision Types' GROUP BY T2.City",0,1
"What are the valid e-mail addresses of the administrator of the school located in the San Bernardino county, City of San Bernardino City Unified that opened between 1/1/2009 to 12/31/2010 whose school types are public Intermediate/Middle Schools and Unified Schools?",challenging,"SELECT T2.AdmEmail1, T2.AdmEmail2 FROM frpm AS T1 INNER JOIN schools AS T2 ON T1.CDSCode = T2.CDSCode WHERE T2.County = 'San Bernardino' AND T2.City = 'San Bernardino' AND T2.DOC = 54 AND strftime('%Y', T2.OpenDate) BETWEEN '2009' AND '2010' AND T2.SOC = 62","SELECT admfname1, admlname1, admemail1, admfname2, admlname2, admemail2, admfname3, admlname3, admemail3 FROM schools WHERE county = 'San Bernardino' AND city = 'City of San Bernardino City Unified' AND opendate BETWEEN '2009-01-01' AND '2010-12-31' AND (soc = '62' OR doc = '54') AND admfname1 IS NOT NULL AND admlname1 IS NOT NULL AND admemail1 IS NOT NULL AND admfname2 IS NOT NULL AND admlname2 IS NOT NULL AND admemail2 IS NOT NULL AND admfname3 IS NOT NULL AND admlname3 IS NOT NULL AND admemail3 IS NOT NULL","SELECT T2.AdmEmail1, T2.AdmEmail2 FROM frpm AS T1 INNER JOIN schools AS T2 ON T1.CDSCode = T2.CDSCode WHERE T2.County = 'San Bernardino' AND T2.City = 'San Bernardino' AND T2.DOC = 54 AND strftime('%Y', T2.OpenDate) BETWEEN '2009' AND '2010' AND T2.SOC = 62",0,1
"List out the account numbers of female clients who are oldest and has lowest average salary, calculate the gap between this lowest average salary with the highest average salary?",challenging,"SELECT T1.account_id , ( SELECT MAX(A11) - MIN(A11) FROM district ) FROM account AS T1 INNER JOIN district AS T2 ON T1.district_id = T2.district_id INNER JOIN disp AS T3 ON T1.account_id = T3.account_id INNER JOIN client AS T4 ON T3.client_id = T4.client_id WHERE T2.district_id = ( SELECT district_id FROM client WHERE gender = 'F' ORDER BY birth_date ASC LIMIT 1 ) ORDER BY T2.A11 DESC LIMIT 1",SELECT account_id FROM account WHERE client_id IN (   SELECT client_id   FROM client   WHERE gender = 'F' ) AND client_id IN (   SELECT client_id   FROM disp   WHERE type = 'OWNER' ) AND client_id IN (   SELECT client_id   FROM district   WHERE a11 = (     SELECT MIN(a11)     FROM district   ) ) AND client_id IN (   SELECT client_id   FROM district   WHERE a11 = (     SELECT MAX(a11)     FROM district   ) ) AND client_id IN (   SELECT client_id   FROM client   WHERE birth_date = (     SELECT MIN(birth_date)     FROM client   ) ) AND client_id IN (   SELECT client_id   FROM client   WHERE birth_date = (     SELECT MAX(birth_date)     FROM client   ) ) AND client_id IN (   SELECT client_id   FROM disp   WHERE type = 'OWNER' ) AND client_id IN (   SELECT client_id   FROM disp   WHERE type = 'OWNER' ) AND client_id IN (   SELECT client_id   FROM disp   WHERE type = 'OWNER' ) AND client_id IN (   SELECT client_id   FROM disp   WHERE type = 'OWNER' ) AND client_id IN (   SELECT client_id   FROM disp   WHERE type = 'OWNER' ) AND client_id IN (   SELECT client_id   FROM disp   WHERE type = 'OWNER' ) AND client_id IN (   SELECT client_id   FROM disp   WHERE type = 'OWNER' ) AND client_id IN (   SELECT client_id   FROM disp   WHERE type = 'OWNER' ) AND client_id IN (   SELECT client_id   FROM disp   WHERE type = 'OWNER' ) AND client_id IN (   SELECT client_id   FROM disp   WHERE type = 'OWNER' ) AND client_id IN (   SELECT client_id   FROM disp   WHERE type = 'OWNER' ) AND client_id IN (   SELECT client_id   FROM disp   WHERE type = 'OWNER' ) AND client_id IN (   SELECT client_id   FROM disp   WHERE type = 'OWNER' ) AND client_id IN (   SELECT client_id   ,"SELECT T1.account_id, T2.a11, T2.a11 - (SELECT MAX(T3.a11) FROM district AS T3) AS Gap FROM client AS T1 INNER JOIN district AS T2 ON T1.district_id = T2.district_id WHERE T1.gender = 'F' AND T1.birth_date = (SELECT MIN(T4.birth_date) FROM client AS T4) ORDER BY T2.a11 ASC",0,0
"For the branch which located in the south Bohemia with biggest number of inhabitants, what is the percentage of the male clients?",challenging,SELECT CAST(SUM(T1.gender = 'M') AS REAL) * 100 / COUNT(T1.client_id) FROM client AS T1 INNER JOIN district AS T2 ON T1.district_id = T2.district_id WHERE T2.A3 = 'south Bohemia' GROUP BY T2.A4 ORDER BY T2.A4 DESC LIMIT 1,NULL,"SELECT DIVIDE(COUNT(T2.client_id), COUNT(T1.client_id)) * 100 FROM client AS T1 INNER JOIN district AS T2 ON T1.district_id = T2.district_id WHERE T2.a3 = 'South Bohemia' AND T2.a4 = (SELECT MAX(T3.a4) FROM district AS T3 WHERE T3.a3 = 'South Bohemia')",0,0
"For the client whose loan was approved first in 1993/7/5, what is the increase rate of his/her account balance from 1993/3/22 to 1998/12/27?",challenging,"SELECT CAST((SUM(IIF(T3.date = '1998-12-27', T3.balance, 0)) - SUM(IIF(T3.date = '1993-03-22', T3.balance, 0))) AS REAL) * 100 / SUM(IIF(T3.date = '1993-03-22', T3.balance, 0)) FROM loan AS T1 INNER JOIN account AS T2 ON T1.account_id = T2.account_id INNER JOIN trans AS T3 ON T3.account_id = T2.account_id WHERE T1.date = '1993-07-05'",SELECT (     (         (             SELECT balance             FROM trans             WHERE account_id = (                     SELECT account_id                     FROM loan                     WHERE status = 'A'                         AND date = '1993-07-05'                     LIMIT 1                 )                 AND date = '1993-03-22'         ) - (             SELECT balance             FROM trans             WHERE account_id = (                     SELECT account_id                     FROM loan                     WHERE status = 'A'                         AND date = '1993-07-05'                     LIMIT 1                 )                 AND date = '1998-12-27'         )     ) / (         SELECT balance         FROM trans         WHERE account_id = (                 SELECT account_id                 FROM loan                 WHERE status = 'A'                     AND date = '1993-07-05'                 LIMIT 1             )             AND date = '1998-12-27'     ) ) * 100 AS increase_rate,SELECT (T1.balance - T2.balance) / T2.balance * 100 FROM trans AS T1 INNER JOIN trans AS T2 ON T1.account_id = T2.account_id WHERE T1.date = '1993-07-05' AND T2.date = '1993-03-22' AND T1.account_id = (SELECT T3.account_id FROM loan AS T3 WHERE T3.status = 'A' AND T3.date = '1993-07-05' ORDER BY T3.date LIMIT 1),0,0
"For loans contracts which are still running where client are in debt, list the district of the and the state the percentage unemployment rate increment from year 1995 to 1996.",challenging,SELECT CAST((T3.A13 - T3.A12) AS REAL) * 100 / T3.A12 FROM loan AS T1 INNER JOIN account AS T2 ON T1.account_id = T2.account_id INNER JOIN district AS T3 ON T2.district_id = T3.district_id WHERE T1.status = 'D',"SELECT d.a3 AS district, d.a2 AS state, (d.a13 - d.a12) / d.a12 * 100 AS unemployment_rate_increment FROM loan l JOIN account a ON l.account_id = a.account_id JOIN client c ON a.account_id = c.client_id JOIN disp d ON c.client_id = d.client_id WHERE l.status = 'D' AND l.date >= '1995-01-01' AND l.date < '1996-01-01' ORDER BY unemployment_rate_increment DESC","SELECT T1.A2, T1.A3, (T1.A13 - T1.A12) / T1.A12 * 100 AS UnemploymentIncrementRate FROM district AS T1 INNER JOIN client AS T2 ON T1.district_id = T2.district_id INNER JOIN disp AS T3 ON T2.client_id = T3.client_id INNER JOIN account AS T4 ON T3.account_id = T4.account_id INNER JOIN loan AS T5 ON T4.account_id = T5.account_id WHERE T5.status = 'D'",0,0
"Please list the account types that are not eligible for loans, and the average income of residents in the district where the account is located exceeds $8000 but is no more than $9000.",challenging,SELECT T3.type FROM district AS T1 INNER JOIN account AS T2 ON T1.district_id = T2.district_id INNER JOIN disp AS T3 ON T2.account_id = T3.account_id WHERE T3.type != 'OWNER' AND T1.A11 BETWEEN 8000 AND 9000,SELECT DISTINCT d.type FROM disp d JOIN account a ON d.account_id = a.account_id JOIN district dis ON a.district_id = dis.district_id WHERE d.type != 'OWNER' AND dis.a11 > 8000 AND dis.a11 <= 9000,"SELECT T1.type, T2.a11 FROM account AS T1 INNER JOIN district AS T2 ON T1.district_id = T2.district_id WHERE T1.type != 'OWNER' AND T2.a11 > 8000 AND T2.a11 <= 9000",1,0
What was the growth rate of the total amount of loans across all accounts for a male client between 1996 and 1997?,challenging,"SELECT CAST((SUM(CASE WHEN STRFTIME('%Y', T1.date) = '1997' THEN T1.amount ELSE 0 END) - SUM(CASE WHEN STRFTIME('%Y', T1.date) = '1996' THEN T1.amount ELSE 0 END)) AS REAL) * 100 / SUM(CASE WHEN STRFTIME('%Y', T1.date) = '1996' THEN T1.amount ELSE 0 END) FROM loan AS T1 INNER JOIN account AS T2 ON T1.account_id = T2.account_id INNER JOIN disp AS T3 ON T3.account_id = T2.account_id INNER JOIN client AS T4 ON T4.client_id = T3.client_id WHERE T4.gender = 'M' AND T3.type = 'OWNER'","SELECT (SUM(amount_1997) - SUM(amount_1996)) / SUM(amount_1996) * 100 AS growth_rate FROM (   SELECT     SUM(CASE WHEN strftime('%Y', loan.date) = '1996' THEN loan.amount ELSE 0 END) AS amount_1996,     SUM(CASE WHEN strftime('%Y', loan.date) = '1997' THEN loan.amount ELSE 0 END) AS amount_1997   FROM loan   JOIN disp ON loan.account_id = disp.account_id   JOIN client ON disp.client_id = client.client_id   WHERE client.gender = 'M' ) AS subquery","SELECT (T1.amount_1997 - T1.amount_1996) / T1.amount_1996 * 100 AS growth_rate FROM (SELECT SUM(T2.amount) AS amount_1996, SUM(T3.amount) AS amount_1997 FROM loan AS T1 INNER JOIN client AS T2 ON T1.account_id = T2.account_id INNER JOIN loan AS T3 ON T1.account_id = T3.account_id WHERE T2.gender = 'M' AND strftime('%Y', T1.date) = '1996' AND strftime('%Y', T3.date) = '1997') AS T1",0,0
How often does account number 3 request an account statement to be released? What was the aim of debiting 3539 in total?,challenging,"SELECT T1.frequency, T2.k_symbol FROM account AS T1 INNER JOIN (SELECT account_id, k_symbol, SUM(amount) AS total_amount FROM `order` GROUP BY account_id, k_symbol) AS T2 ON T1.account_id = T2.account_id WHERE T1.account_id = 3 AND T2.total_amount = 3539","SELECT COUNT(*) AS frequency, SUM(amount) AS total_amount FROM trans WHERE account_id = 3 AND type = 'debit' AND operation = 'withdrawal' AND k_symbol = 'account statement'",SELECT COUNT(*) FROM trans WHERE account_id = 3 AND type = 'disposition',0,0
On average how many carcinogenic molecules are single bonded?,challenging,"SELECT AVG(single_bond_count) FROM (SELECT T3.molecule_id, COUNT(T1.bond_type) AS single_bond_count FROM bond AS T1  INNER JOIN atom AS T2 ON T1.molecule_id = T2.molecule_id INNER JOIN molecule AS T3 ON T3.molecule_id = T2.molecule_id WHERE T1.bond_type = '-' AND T3.label = '+' GROUP BY T3.molecule_id) AS subquery",SELECT AVG(bond_type = '-') AS average FROM molecule JOIN atom ON molecule.molecule_id = atom.molecule_id JOIN connected ON atom.atom_id = connected.atom_id JOIN bond ON connected.bond_id = bond.bond_id WHERE molecule.label = '+',SELECT AVG(T1.bond_type = '-') FROM connected AS T1 INNER JOIN atom AS T2 ON T1.atom_id = T2.atom_id INNER JOIN molecule AS T3 ON T2.molecule_id = T3.molecule_id WHERE T3.label = '+',0,0
What elements are in the TR004_8_9 bond atoms?,challenging,SELECT DISTINCT T1.element FROM atom AS T1 INNER JOIN connected AS T2 ON T1.atom_id = T2.atom_id WHERE T2.bond_id = 'TR004_8_9',SELECT element FROM atom WHERE atom_id IN (SELECT atom_id FROM connected WHERE bond_id = 'TR004_8_9') OR atom_id IN (SELECT atom_id2 FROM connected WHERE bond_id = 'TR004_8_9'),SELECT T1.element FROM atom AS T1 INNER JOIN connected AS T2 ON T1.atom_id = T2.atom_id INNER JOIN bond AS T3 ON T2.bond_id = T3.bond_id WHERE T3.bond_id = 'TR004_8_9',1,1
What elements are in a double type bond?,challenging,SELECT DISTINCT T1.element FROM atom AS T1 INNER JOIN bond AS T2 ON T1.molecule_id = T2.molecule_id INNER JOIN connected AS T3 ON T1.atom_id = T3.atom_id WHERE T2.bond_type = '=',SELECT DISTINCT element FROM atom WHERE atom_id IN (   SELECT atom_id   FROM connected   WHERE bond_id IN (     SELECT bond_id     FROM bond     WHERE bond_type = '='   ) ),SELECT DISTINCT T1.element FROM atom AS T1 INNER JOIN connected AS T2 ON T1.atom_id = T2.atom_id INNER JOIN bond AS T3 ON T2.bond_id = T3.bond_id WHERE T3.bond_type = '=',0,0
Which element is the least numerous in non-carcinogenic molecules?,challenging,"SELECT T.element FROM (SELECT T1.element, COUNT(DISTINCT T1.molecule_id) FROM atom AS T1 INNER JOIN molecule AS T2 ON T1.molecule_id = T2.molecule_id WHERE T2.label = '-' GROUP BY T1.element ORDER BY COUNT(DISTINCT T1.molecule_id) ASC LIMIT 1) t","SELECT element, COUNT(*) AS count FROM atom WHERE molecule_id IN (   SELECT molecule_id   FROM molecule   WHERE label = '-' ) GROUP BY element ORDER BY count ASC LIMIT 1",SELECT element FROM atom AS T1 INNER JOIN molecule AS T2 ON T1.molecule_id = T2.molecule_id WHERE T2.label = '-' GROUP BY element ORDER BY COUNT(element) LIMIT 1,0,1
How many atoms with iodine and with sulfur type elements are there in single bond molecules?,challenging,"SELECT COUNT(DISTINCT CASE WHEN T1.element = 'i' THEN T1.atom_id ELSE NULL END) AS iodine_nums , COUNT(DISTINCT CASE WHEN T1.element = 's' THEN T1.atom_id ELSE NULL END) AS sulfur_nums FROM atom AS T1 INNER JOIN connected AS T2 ON T1.atom_id = T2.atom_id INNER JOIN bond AS T3 ON T2.bond_id = T3.bond_id WHERE T3.bond_type = '-'",SELECT COUNT(DISTINCT atom_id) FROM connected WHERE bond_id IN (   SELECT bond_id   FROM bond   WHERE bond_type = '-' ) AND atom_id IN (   SELECT atom_id   FROM atom   WHERE element = 'i' ) AND atom_id2 IN (   SELECT atom_id   FROM atom   WHERE element = 's' ),SELECT COUNT(DISTINCT T1.atom_id) FROM atom AS T1 INNER JOIN connected AS T2 ON T1.atom_id = T2.atom_id INNER JOIN bond AS T3 ON T2.bond_id = T3.bond_id WHERE T1.element = 'i' AND T3.bond_type = '-' AND T2.atom_id2 IN (SELECT T4.atom_id FROM atom AS T4 WHERE T4.element = 's'),0,0
What percentage of carcinogenic-type molecules does not contain fluorine?,challenging,SELECT CAST(COUNT(DISTINCT CASE WHEN T1.element <> 'f' THEN T2.molecule_id ELSE NULL END) AS REAL) * 100 / COUNT(DISTINCT T2.molecule_id) FROM atom AS T1 INNER JOIN molecule AS T2 ON T1.molecule_id = T2.molecule_id WHERE T2.label = '+',NULL,"SELECT DIVIDE(COUNT(DISTINCT T1.molecule_id) * 100, (SELECT COUNT(DISTINCT T2.molecule_id) FROM molecule AS T2 WHERE T2.label = '+')) FROM molecule AS T1 WHERE T1.label = '+' AND T1.molecule_id NOT IN (SELECT T3.molecule_id FROM atom AS T3 WHERE T3.element = 'f')",0,0
What is the percentage of carcinogenic molecules in triple type bonds?,challenging,SELECT CAST(COUNT(DISTINCT CASE WHEN T2.label = '+' THEN T2.molecule_id ELSE NULL END) AS REAL) * 100 / COUNT(DISTINCT T2.molecule_id) FROM atom AS T1 INNER JOIN molecule AS T2 ON T1.molecule_id = T2.molecule_id INNER JOIN bond AS T3 ON T2.molecule_id = T3.molecule_id WHERE T3.bond_type = '#',NULL,"SELECT DIVIDE(SUM(bond_type = '#') * 100, COUNT(bond_id)) as percent FROM molecule INNER JOIN bond ON molecule.molecule_id = bond.molecule_id WHERE label = '+'",0,0
Please list top three elements of the toxicology of the molecule TR000 in alphabetical order.,challenging,SELECT DISTINCT T.element FROM atom AS T WHERE T.molecule_id = 'TR000' ORDER BY T.element LIMIT 3,SELECT element FROM atom WHERE molecule_id = 'TR000' ORDER BY element LIMIT 3,SELECT element FROM atom WHERE molecule_id = 'TR000' ORDER BY element LIMIT 3,0,0
What are the elements of the toxicology and label of molecule TR060?,challenging,"SELECT DISTINCT T1.element, T2.label FROM atom AS T1 INNER JOIN molecule AS T2 ON T1.molecule_id = T2.molecule_id WHERE T2.molecule_id = 'TR060'","SELECT atom.element, molecule.label FROM atom JOIN connected ON atom.atom_id = connected.atom_id JOIN molecule ON connected.molecule_id = molecule.molecule_id WHERE molecule.molecule_id = 'TR060'","SELECT T1.element, T2.label FROM atom AS T1 INNER JOIN molecule AS T2 ON T1.molecule_id = T2.molecule_id WHERE T2.molecule_id = 'TR060'",0,1
Which bond type accounted for the majority of the bonds found in molecule TR010 and state whether or not this molecule is carcinogenic?,challenging,"SELECT T.bond_type FROM ( SELECT T1.bond_type, COUNT(T1.molecule_id) FROM bond AS T1  WHERE T1.molecule_id = 'TR010' GROUP BY T1.bond_type ORDER BY COUNT(T1.molecule_id) DESC LIMIT 1 ) AS T","SELECT bond_type, COUNT(*) AS bond_count FROM bond WHERE molecule_id = 'TR010' GROUP BY bond_type ORDER BY bond_count DESC LIMIT 1","SELECT T1.bond_type, T2.carcinogenic FROM bond AS T1 INNER JOIN molecule AS T2 ON T1.molecule_id = T2.molecule_id WHERE T1.molecule_id = 'TR010' AND T1.bond_type = (SELECT MAX(COUNT(bond_type)) FROM bond WHERE molecule_id = 'TR010')",0,0
"List all the elements of the toxicology of the molecule ""TR004"".",challenging,SELECT DISTINCT T.element FROM atom AS T WHERE T.molecule_id = 'TR004',SELECT atom.element FROM atom JOIN connected ON atom.atom_id = connected.atom_id JOIN bond ON connected.bond_id = bond.bond_id JOIN molecule ON bond.molecule_id = molecule.molecule_id WHERE molecule.label = 'TR004',SELECT atom.element FROM atom INNER JOIN connected ON atom.atom_id = connected.atom_id INNER JOIN molecule ON atom.molecule_id = molecule.molecule_id WHERE molecule.label = 'TR004',0,0
List all the elements of atoms that can not bond with any other atoms.,challenging,SELECT DISTINCT T.element FROM atom AS T WHERE T.element NOT IN ( SELECT DISTINCT T1.element FROM atom AS T1 INNER JOIN connected AS T2 ON T1.atom_id = T2.atom_id ),SELECT element FROM atom WHERE atom_id NOT IN (   SELECT atom_id   FROM connected ) ,SELECT element FROM atom WHERE atom_id NOT IN (SELECT atom_id FROM connected),0,0
What are the elements of the atoms of TR144_8_19?,challenging,SELECT T2.element FROM connected AS T1 INNER JOIN atom AS T2 ON T1.atom_id = T2.atom_id WHERE T1.bond_id = 'TR144_8_19',SELECT element FROM atom WHERE atom_id IN (SELECT atom_id FROM connected WHERE bond_id = 'TR144_8_19'),SELECT element FROM atom WHERE atom_id IN (SELECT atom_id FROM connected WHERE bond_id = 'TR144_8_19'),1,1
List the elements of all the triple bonds.,challenging,SELECT DISTINCT T3.element FROM bond AS T1 INNER JOIN connected AS T2 ON T1.bond_id = T2.bond_id INNER JOIN atom AS T3 ON T2.atom_id = T3.atom_id WHERE T1.bond_type = '#',SELECT atom.element FROM atom JOIN connected ON atom.atom_id = connected.atom_id JOIN bond ON connected.bond_id = bond.bond_id WHERE bond.bond_type = '#',SELECT T1.element FROM atom AS T1 INNER JOIN connected AS T2 ON T1.atom_id = T2.atom_id INNER JOIN bond AS T3 ON T2.bond_id = T3.bond_id WHERE T3.bond_type = '#',1,1
What is the composition of element chlorine in percentage among the single bond molecules?,challenging,"SELECT CAST(COUNT(CASE WHEN T.element = 'cl' THEN T.atom_id ELSE NULL END) AS REAL) * 100 / COUNT(T.atom_id) FROM ( SELECT T1.atom_id, T1.element FROM atom AS T1 INNER JOIN molecule AS T2 ON T1.molecule_id = T2.molecule_id INNER JOIN bond AS T3 ON T2.molecule_id = T3.molecule_id WHERE T3.bond_type = '-' ) AS T",NULL,"SELECT molecule_id, COUNT(atom_id) as count FROM atom WHERE molecule_id IN (SELECT molecule_id FROM bond WHERE bond_type = '-') GROUP BY molecule_id HAVING COUNT(atom_id) > 1",0,0
What are the elements for bond id TR001_10_11?,challenging,SELECT T2.element FROM connected AS T1 INNER JOIN atom AS T2 ON T1.atom_id = T2.atom_id WHERE T1.bond_id = 'TR001_10_11',SELECT atom.element FROM atom JOIN connected ON atom.atom_id = connected.atom_id WHERE connected.bond_id = 'TR001_10_11',SELECT T1.element FROM atom AS T1 INNER JOIN connected AS T2 ON T1.atom_id = T2.atom_id WHERE T2.bond_id = 'TR001_10_11',1,1
What are the toxicology elements associated with bond ID TR000_1_2?,challenging,SELECT T1.element FROM atom AS T1 INNER JOIN connected AS T2 ON T1.atom_id = T2.atom_id WHERE T2.bond_id = 'TR000_1_2',SELECT atom.element FROM atom JOIN connected ON atom.atom_id = connected.atom_id WHERE connected.bond_id = 'TR000_1_2',SELECT element FROM atom WHERE atom_id IN (SELECT atom_id FROM connected WHERE bond_id = 'TR000_1_2'),1,1
Tally the toxicology element of the 4th atom of each molecule that was carcinogenic.,challenging,"SELECT DISTINCT T1.element FROM atom AS T1 INNER JOIN molecule AS T2 ON T1.molecule_id = T2.molecule_id WHERE T2.label = '+' AND SUBSTR(T1.atom_id, -1) = '4' AND LENGTH(T1.atom_id) = 7","SELECT element, COUNT(*) AS count FROM atom WHERE molecule_id IN (   SELECT molecule_id   FROM molecule   WHERE label = '+' ) AND atom_id LIKE '%4' GROUP BY element","SELECT T1.element FROM atom AS T1 INNER JOIN molecule AS T2 ON T1.molecule_id = T2.molecule_id WHERE T2.label = '+' AND substr(T1.atom_id, 7, 1) = '4'",0,0
What is the ratio of Hydrogen elements in molecule ID TR006? List the ratio with its label.,challenging,"WITH SubQuery AS (SELECT DISTINCT T1.atom_id, T1.element, T1.molecule_id, T2.label FROM atom AS T1 INNER JOIN molecule AS T2 ON T1.molecule_id = T2.molecule_id WHERE T2.molecule_id = 'TR006') SELECT CAST(COUNT(CASE WHEN element = 'h' THEN atom_id ELSE NULL END) AS REAL) / (CASE WHEN COUNT(atom_id) = 0 THEN NULL ELSE COUNT(atom_id) END) AS ratio, label FROM SubQuery GROUP BY label","SELECT ratio, label FROM molecule WHERE molecule_id = 'TR006'","SELECT T1.label, T2.ratio FROM molecule AS T1 INNER JOIN (SELECT molecule_id, SUM(element = 'h') / COUNT(element) AS ratio FROM atom GROUP BY molecule_id) AS T2 ON T1.molecule_id = T2.molecule_id WHERE T1.molecule_id = 'TR006'",0,0
Name chemical elements that form a bond TR001_10_11.,challenging,SELECT T1.element FROM atom AS T1 INNER JOIN connected AS T2 ON T1.atom_id = T2.atom_id INNER JOIN bond AS T3 ON T2.bond_id = T3.bond_id WHERE T3.bond_id = 'TR001_10_11',SELECT element FROM atom WHERE atom_id IN (   SELECT atom_id   FROM connected   WHERE bond_id = 'TR001_10_11' ) UNION SELECT element FROM atom WHERE atom_id IN (   SELECT atom_id2   FROM connected   WHERE bond_id = 'TR001_10_11' ),SELECT T1.element FROM atom AS T1 INNER JOIN connected AS T2 ON T1.atom_id = T2.atom_id WHERE T2.bond_id = 'TR001_10_11',1,1
