Question,Difficulty,Ground Truth SQL,Basic Predicted SQL,Advanced Predicted SQL,EX Basic,EX Advanced
Which superhero has the most durability published by Dark Horse Comics?,challenging,SELECT T1.superhero_name FROM superhero AS T1 INNER JOIN hero_attribute AS T2 ON T1.id = T2.hero_id INNER JOIN attribute AS T3 ON T3.id = T2.attribute_id INNER JOIN publisher AS T4 ON T4.id = T1.publisher_id WHERE T4.publisher_name = 'Dark Horse Comics' AND T3.attribute_name = 'Durability' ORDER BY T2.attribute_value DESC LIMIT 1,SELECT superhero_name FROM superhero JOIN publisher ON superhero.publisher_id = publisher.id JOIN hero_attribute ON superhero.id = hero_attribute.hero_id JOIN attribute ON hero_attribute.attribute_id = attribute.id WHERE publisher_name = 'Dark Horse Comics' AND attribute_name = 'durability' AND attribute_value = (   SELECT MAX(attribute_value)   FROM hero_attribute   JOIN attribute ON hero_attribute.attribute_id = attribute.id   WHERE attribute_name = 'durability' ) ORDER BY superhero_name,SELECT T1.superhero_name FROM superhero AS T1 INNER JOIN hero_attribute AS T2 ON T1.id = T2.hero_id INNER JOIN attribute AS T3 ON T2.attribute_id = T3.id INNER JOIN publisher AS T4 ON T1.publisher_id = T4.id WHERE T3.attribute_name = 'durability' AND T4.publisher_name = 'Dark Horse Comics' AND T2.attribute_value = (SELECT MAX(T5.attribute_value) FROM hero_attribute AS T5 INNER JOIN attribute AS T6 ON T5.attribute_id = T6.id WHERE T6.attribute_name = 'durability'),0,0
"List the eyes, hair and skin colour of all female superheroes published by Dark Horse Comics.",challenging,"SELECT T1.eye_colour_id, T1.hair_colour_id, T1.skin_colour_id FROM superhero AS T1 INNER JOIN publisher AS T2 ON T2.id = T1.publisher_id INNER JOIN gender AS T3 ON T3.id = T1.gender_id WHERE T2.publisher_name = 'Dark Horse Comics' AND T3.gender = 'Female'",NULL,"SELECT T1.eye_colour_id, T1.hair_colour_id, T1.skin_colour_id FROM superhero AS T1 INNER JOIN gender AS T2 ON T1.gender_id = T2.id INNER JOIN publisher AS T3 ON T1.publisher_id = T3.id WHERE T2.gender = 'Female' AND T3.publisher_name = 'Dark Horse Comics'",0,1
"Which superhero has the same eyes, hair and skin colour? Indicate the publisher of the superhero.",challenging,"SELECT T1.superhero_name, T2.publisher_name FROM superhero AS T1 INNER JOIN publisher AS T2 ON T1.publisher_id = T2.id WHERE T1.eye_colour_id = T1.hair_colour_id AND T1.eye_colour_id = T1.skin_colour_id",NULL,"SELECT T1.superhero_name, T2.publisher_name FROM superhero AS T1 INNER JOIN publisher AS T2 ON T1.publisher_id = T2.id WHERE T1.hair_colour_id = T1.skin_colour_id AND T1.hair_colour_id = T1.eye_colour_id",0,1
What is the percentage of blue female superheroes among all female superheroes?,challenging,SELECT CAST(COUNT(CASE WHEN T3.colour = 'Blue' THEN T1.id ELSE NULL END) AS REAL) * 100 / COUNT(T1.id) FROM superhero AS T1 INNER JOIN gender AS T2 ON T1.gender_id = T2.id INNER JOIN colour AS T3 ON T1.skin_colour_id = T3.id WHERE T2.gender = 'Female',NULL,SELECT (COUNT(T1.id) * 100.0 / (SELECT COUNT(*) FROM superhero WHERE gender_id = (SELECT id FROM gender WHERE gender = 'Female'))) AS percentage FROM superhero AS T1 INNER JOIN colour AS T2 ON T1.skin_colour_id = T2.id WHERE T2.colour = 'Blue' AND T1.gender_id = (SELECT id FROM gender WHERE gender = 'Female'),0,1
How many percent of female heroes were published by Marvel Comics?,challenging,SELECT CAST(COUNT(CASE WHEN T2.publisher_name = 'Marvel Comics' THEN 1 ELSE NULL END) AS REAL) * 100 / COUNT(T1.id) FROM superhero AS T1 INNER JOIN publisher AS T2 ON T1.publisher_id = T2.id INNER JOIN gender AS T3 ON T1.gender_id = T3.id WHERE T3.gender = 'Female',NULL,"SELECT MULTIPLY(DIVIDE(SUM(gender = 'Female' WHERE publisher_name = 'Marvel Comics'), COUNT(publisher_name = 'Marvel Comics')), 100) FROM superhero AS T1 INNER JOIN publisher AS T2 ON T1.publisher_id = T2.id WHERE T2.publisher_name = 'Marvel Comics'",0,0
"Among the bad superheroes, what is the percentage of female superheroes?",challenging,SELECT CAST(COUNT(CASE WHEN T3.gender = 'Female' THEN T1.id ELSE NULL END) AS REAL) * 100 / COUNT(T1.id) FROM superhero AS T1 INNER JOIN alignment AS T2 ON T1.alignment_id = T2.id INNER JOIN gender AS T3 ON T1.gender_id = T3.id WHERE T2.alignment = 'Bad',NULL,SELECT (COUNT(T1.id) * 100.0 / (SELECT COUNT(T2.id) FROM superhero AS T2 INNER JOIN alignment AS T3 ON T2.alignment_id = T3.id WHERE T3.id = 2)) FROM superhero AS T1 INNER JOIN gender AS T4 ON T1.gender_id = T4.id INNER JOIN alignment AS T5 ON T1.alignment_id = T5.id WHERE T5.id = 2 AND T4.id = 2,0,1
"In superheroes with missing weight data, calculate the difference between the number of superheroes with blue eyes and no eye color.",challenging,SELECT SUM(CASE WHEN T2.id = 7 THEN 1 ELSE 0 END) - SUM(CASE WHEN T2.id = 1 THEN 1 ELSE 0 END) FROM superhero AS T1 INNER JOIN colour AS T2 ON T1.eye_colour_id = T2.id WHERE T1.weight_kg = 0 OR T1.weight_kg is NULL,NULL,SELECT (SELECT COUNT(*) FROM superhero WHERE weight_kg = 0 OR weight_kg IS NULL AND eye_colour_id = (SELECT id FROM colour WHERE colour = 'blue')) - (SELECT COUNT(*) FROM superhero WHERE weight_kg = 0 OR weight_kg IS NULL AND eye_colour_id = (SELECT id FROM colour WHERE colour = 'no eye color')),0,0
Which publisher created more superheroes: DC or Marvel Comics? Find the difference in the number of superheroes.,challenging,SELECT SUM(CASE WHEN T2.publisher_name = 'DC Comics' THEN 1 ELSE 0 END) - SUM(CASE WHEN T2.publisher_name = 'Marvel Comics' THEN 1 ELSE 0 END) FROM superhero AS T1 INNER JOIN publisher AS T2 ON T1.publisher_id = T2.id,"SELECT publisher_name, COUNT(*) AS superhero_count FROM superhero INNER JOIN publisher ON superhero.publisher_id = publisher.id GROUP BY publisher_name","SELECT difference FROM (SELECT SUM(publisher_name = 'DC Comics') AS dc_count, SUM(publisher_name = 'Marvel Comics') AS marvel_count FROM superhero) AS subquery",0,0
"Among all superheroes created by George Lucas, identify the percentage of female superheroes.",challenging,SELECT CAST(COUNT(CASE WHEN T3.gender = 'Female' THEN 1 ELSE NULL END) AS REAL) * 100 / COUNT(T1.id) FROM superhero AS T1 INNER JOIN publisher AS T2 ON T1.publisher_id = T2.id INNER JOIN gender AS T3 ON T1.gender_id = T3.id WHERE T2.publisher_name = 'George Lucas',"SELECT percentage FROM (   SELECT SUM(gender = 'Female' WHERE publisher_name = 'George Lucas') AS female_count,          COUNT(publisher_name = 'George Lucas') AS total_count,          (SUM(gender = 'Female' WHERE publisher_name = 'George Lucas') / COUNT(publisher_name = 'George Lucas')) * 100 AS percentage   FROM superhero   WHERE publisher_name = 'George Lucas' ) ",SELECT COUNT(T2.gender) * 100.0 / (SELECT COUNT(*) FROM superhero AS T1 INNER JOIN gender AS T2 ON T1.gender_id = T2.id WHERE T1.publisher_id = (SELECT id FROM publisher WHERE publisher_name = 'George Lucas')) FROM superhero AS T1 INNER JOIN gender AS T2 ON T1.gender_id = T2.id WHERE T1.publisher_id = (SELECT id FROM publisher WHERE publisher_name = 'George Lucas') AND T2.gender = 'Female',0,1
"Among all superheroes in Marvel Comics, identify the percentage of 'good' superheroes.",challenging,SELECT CAST(COUNT(CASE WHEN T3.alignment = 'Good' THEN T1.id ELSE NULL END) AS REAL) * 100 / COUNT(T1.id) FROM superhero AS T1 INNER JOIN publisher AS T2 ON T1.publisher_id = T2.id INNER JOIN alignment AS T3 ON T1.alignment_id = T3.id WHERE T2.publisher_name = 'Marvel Comics',SELECT (COUNT(CASE WHEN alignment = 'Good' AND publisher_name = 'Marvel Comics' THEN 1 END) * 100.0 / COUNT(CASE WHEN publisher_name = 'Marvel Comics' THEN 1 END)) AS percentage FROM superhero JOIN publisher ON superhero.publisher_id = publisher.id,SELECT COUNT(publisher_name = 'Marvel Comics') * 100.0 / COUNT(publisher_name = 'Marvel Comics') FROM superhero AS T1 INNER JOIN publisher AS T2 ON T1.publisher_id = T2.id WHERE T2.publisher_name = 'Marvel Comics' AND T1.alignment = 'Good',0,0
"Paul di Resta was in the No. 853 race, what percent faster did he finish in the 853rd race than the next race for the fastest lap speed?",challenging,"SELECT (SUM(IIF(T2.raceId = 853, T2.fastestLapSpeed, 0)) - SUM(IIF(T2.raceId = 854, T2.fastestLapSpeed, 0))) * 100 / SUM(IIF(T2.raceId = 853, T2.fastestLapSpeed, 0)) FROM drivers AS T1 INNER JOIN results AS T2 ON T2.driverId = T1.driverId WHERE T1.forename = 'Paul' AND T1.surname = 'di Resta'",SELECT (fastestLapSpeed(raceId = 853) - fastestLapSpeed(raceId = 854)) * 100 / fastestLapSpeed(raceId = 853) AS percentage FROM drivers WHERE drivers.forename = 'Paul' AND drivers.surname = 'di Resta',SELECT (fastestLapSpeed(raceId = 853) - fastestLapSpeed(raceId = 854)) * 100 / fastestLapSpeed(raceId = 853) FROM drivers WHERE drivers.forename = 'Paul' AND drivers.surname = 'di Resta',0,0
Calculate the percentage whereby Hamilton was not at the 1st track of the the f1 circuit since 2010.,challenging,SELECT CAST(COUNT(CASE WHEN T2.position <> 1 THEN T2.position END) AS REAL) * 100 / COUNT(T2.driverStandingsId) FROM races AS T1 INNER JOIN driverStandings AS T2 ON T2.raceId = T1.raceId INNER JOIN drivers AS T3 ON T3.driverId = T2.driverId WHERE T3.surname = 'Hamilton' AND T1.year >= 2010,NULL,SELECT (COUNT(T1.raceId) WHERE T2.surname = 'Hamilton' AND T1.position > 1) / (COUNT(T1.raceId) WHERE T2.surname = 'Hamilton') FROM results AS T1 INNER JOIN drivers AS T2 ON T1.driverId = T2.driverId INNER JOIN races AS T3 ON T1.raceId = T3.raceId WHERE T3.year >= 2010,0,0
How much faster in percentage is the champion than the driver who finished the race last in the 2008 Australian Grand Prix?,challenging,"WITH time_in_seconds AS ( SELECT T1.positionOrder, CASE WHEN T1.positionOrder = 1 THEN (CAST(SUBSTR(T1.time, 1, 1) AS REAL) * 3600) + (CAST(SUBSTR(T1.time, 3, 2) AS REAL) * 60) + CAST(SUBSTR(T1.time, 6) AS REAL) ELSE CAST(SUBSTR(T1.time, 2) AS REAL) END AS time_seconds FROM results AS T1 INNER JOIN races AS T2 ON T1.raceId = T2.raceId WHERE T2.name = 'Australian Grand Prix' AND T1.time IS NOT NULL AND T2.year = 2008 ), champion_time AS ( SELECT time_seconds FROM time_in_seconds WHERE positionOrder = 1), last_driver_incremental AS ( SELECT time_seconds FROM time_in_seconds WHERE positionOrder = (SELECT MAX(positionOrder) FROM time_in_seconds) ) SELECT (CAST((SELECT time_seconds FROM last_driver_incremental) AS REAL) * 100) / (SELECT time_seconds + (SELECT time_seconds FROM last_driver_incremental) FROM champion_time)",SELECT (   (     (       (         (           (             (               (                 (                   (                     (                       (                         (                           (                             (                               (                                 (                                   (                                     (                                       (                                         (                                           (                                             (                                               (                                                 (                                                   (                                                     (                                                       (                                                         (                                                           (                                                             (                                                               (                                                                 (                                                                   (                                                                     (                                                                       (                                                                         (                                                                           (                                                                             (                                                                               (                                                                                 (                                                                                   (                                                                                     (                                                                                       (                                                                                         (                                                                                           (                                                                                             (                                                                                               (                                                                                                 (                                                                                                   (                                                                                                     (                                                                                                       (                                                                                                         (                                                                                                           (                                                                                                             (                                                                                                               (                                                                                                                 (                                                                                                                   (                                                                                                                     (                                                                                                                       (                                                                                                                         (                                                                                                                           (                                                                                                                             (                                                                                                                               (                                                                                                                                 (                                                                                                                                   (                                                                                                                                     (                                                                                                                                       (                                                                                                                                         (                                                                                                                                           (                                                                                                                                             (                                                                                                                                               (                                                                                                                                                 (                                                                                                                                                   (                                                                                                                                                     (                                                                                                                                                       (                                                                                                                                                         (                                                                                                                                                           (                                                                                                                                                             (                                                                                                                                                               (                                                                                                                                                                 (                                                                                                                                                                   (                                                                                                                                                                     (                                                                                                                                                                       (                                                                                                                                                                         (                                                                                                                                                                           (                                                                                                                                                                             (                                                                                                                                                                               (                                                                                                                                                                                 (                                                                                                                                                                                   (                                                                                                                                                                                     (                                                                                                                                                                                       (                                                                                                                                                                                         (                                                                                                                                                                                           (                                                                                                                                                                                             (                                                                                                                                                                                               (                                                                                                                                                                                                 (                                                                                                                                                                                                   (                                                                                                                                                                                                     (                                                                                                                                                                                                       (                                                                                                                                                                                                         (                                                                                                                                                                                                           (                                                                                                                                                                                                             (                                                                                                                                                            ,"SELECT (strftime('%s', T1.time) - strftime('%s', T2.time)) / (strftime('%s', T3.time) - strftime('%s', T2.time)) * 100 FROM results AS T1 INNER JOIN results AS T2 ON T1.raceid = T2.raceid AND T1.position = 1 AND T2.position = (SELECT MAX(position) FROM results WHERE raceid = T1.raceid) INNER JOIN results AS T3 ON T1.raceid = T3.raceid AND T3.position = (SELECT MAX(position) FROM results WHERE raceid = T1.raceid AND position <> (SELECT MAX(position) FROM results WHERE raceid = T1.raceid)) WHERE T1.raceid = (SELECT raceid FROM races WHERE year = 2008 AND name = 'Australian Grand Prix')",0,0
Please calculate the race completion percentage of Japanese drivers from 2007 to 2009.,challenging,"SELECT CAST(SUM(IIF(T1.time IS NOT NULL, 1, 0)) AS REAL) * 100 / COUNT(T1.raceId) FROM results AS T1 INNER JOIN races AS T2 on T1.raceId = T2.raceId INNER JOIN drivers AS T3 on T1.driverId = T3.driverId WHERE T3.nationality = 'Japanese' AND T2.year BETWEEN 2007 AND 2009",SELECT (COUNT(DriverID) * 100.0 / (SELECT COUNT(DriverID) FROM drivers WHERE nationality = 'Japanese')) AS race_completion_percentage FROM results JOIN drivers ON results.driverid = drivers.driverid WHERE drivers.nationality = 'Japanese' AND results.time IS NOT NULL AND results.year BETWEEN 2007 AND 2009,SELECT COUNT(T2.DriverID) * 100 / (SELECT COUNT(T3.DriverID) FROM results AS T3 INNER JOIN drivers AS T4 ON T3.DriverID = T4.DriverID WHERE T4.Nationality = 'Japanese' AND T3.Year BETWEEN 2007 AND 2009) AS Percentage FROM results AS T1 INNER JOIN drivers AS T2 ON T1.DriverID = T2.DriverID WHERE T2.Nationality = 'Japanese' AND T1.Year BETWEEN 2007 AND 2009 AND T1.Time IS NOT NULL,0,0
"What is the average time in seconds of champion for each year, before year 1975?",challenging,"WITH time_in_seconds AS ( SELECT T2.year, T2.raceId, T1.positionOrder, CASE WHEN T1.positionOrder = 1 THEN (CAST(SUBSTR(T1.time, 1, 1) AS REAL) * 3600) + (CAST(SUBSTR(T1.time, 3, 2) AS REAL) * 60) + CAST(SUBSTR(T1.time, 6,2) AS REAL )   + CAST(SUBSTR(T1.time, 9) AS REAL)/1000 ELSE 0 END AS time_seconds FROM results AS T1 INNER JOIN races AS T2 ON T1.raceId = T2.raceId WHERE T1.time IS NOT NULL ), champion_time AS ( SELECT year, raceId, time_seconds FROM time_in_seconds WHERE positionOrder = 1 ) SELECT year, AVG(time_seconds) FROM champion_time WHERE year < 1975 GROUP BY year HAVING AVG(time_seconds) IS NOT NULL",NULL,"SELECT AVG(CAST(SUBSTR(T1.time, 1, 2) AS INTEGER) * 3600 + CAST(SUBSTR(T1.time, 4, 2) AS INTEGER) * 60 + CAST(SUBSTR(T1.time, 7, 2) AS INTEGER)) FROM results AS T1 INNER JOIN races AS T2 ON T1.raceid = T2.raceid INNER JOIN driverstandings AS T3 ON T1.driverid = T3.driverid AND T1.raceid = T3.raceid WHERE T2.year < 1975 AND T3.position = 1 AND T1.time IS NOT NULL GROUP BY T2.year",0,0
"From 2000 to 2005, what percentage of drivers who were born before 1985 and the lap numbers were over 50?",challenging,"SELECT CAST(SUM(IIF(STRFTIME('%Y', T3.dob) < '1985' AND T1.laps > 50, 1, 0)) AS REAL) * 100 / COUNT(*) FROM results AS T1 INNER JOIN races AS T2 on T1.raceId = T2.raceId INNER JOIN drivers AS T3 on T1.driverId = T3.driverId WHERE T2.year BETWEEN 2000 AND 2005",SELECT (COUNT(driverId) * 100.0 / (SELECT COUNT(*) FROM drivers WHERE year(dob) < 1985)) AS percentage FROM drivers WHERE year(dob) < 1985 AND laps > 50 AND year(dob) BETWEEN 2000 AND 2005,SELECT COUNT(T1.driverId) / (SELECT COUNT(T2.driverId) FROM drivers AS T2 WHERE T2.year BETWEEN 2000 AND 2005) * 100 FROM drivers AS T1 WHERE T1.year < 1985 AND T1.laps > 50,0,0
List down top 3 German drivers who has the shortest average pit stop duration and were born between 1980-1985.,challenging,"SELECT T2.forename, T2.surname FROM pitStops AS T1 INNER JOIN drivers AS T2 on T1.driverId = T2.driverId WHERE T2.nationality = 'German' AND STRFTIME('%Y', T2.dob) BETWEEN '1980' AND '1985' GROUP BY T2.forename, T2.surname ORDER BY AVG(T1.duration) LIMIT 3","SELECT drivers.forename || ' ' || drivers.surname AS full_name, AVG(pitstops.duration) AS avg_pitstop_duration FROM drivers JOIN pitstops ON drivers.driverid = pitstops.driverid WHERE drivers.nationality = 'German' AND YEAR(drivers.dob) BETWEEN 1980 AND 1985 GROUP BY drivers.driverid ORDER BY avg_pitstop_duration ASC LIMIT 3","SELECT T1.forename, T1.surname, AVG(T2.duration) AS avg_duration FROM drivers AS T1 INNER JOIN pitstops AS T2 ON T1.driverid = T2.driverid WHERE T1.nationality = 'German' AND YEAR(T1.dob) BETWEEN 1980 AND 1985 GROUP BY T1.driverid ORDER BY avg_duration ASC LIMIT 3",0,0
