Question,Difficulty,Ground Truth SQL,Basic Predicted SQL,Advanced Predicted SQL,EX Basic,EX Advanced
"What is the most common illness that doctors identified among the patients whose lab work was done between 1/1/1985, and 12/31/1995?",challenging,SELECT T2.Diagnosis FROM Examination AS T1 INNER JOIN Patient AS T2 ON T1.ID = T2.ID WHERE T1.`Examination Date` BETWEEN '1985-01-01' AND '1995-12-31' GROUP BY T2.Diagnosis ORDER BY COUNT(T2.Diagnosis) DESC LIMIT 1,"SELECT Diagnosis, COUNT(*) AS Count FROM Examination WHERE `Examination Date` BETWEEN '1985-01-01' AND '1995-12-31' GROUP BY Diagnosis ORDER BY Count DESC LIMIT 1","SELECT Diagnosis, COUNT(Diagnosis) AS Count FROM examination WHERE `Examination Date` BETWEEN '1985-01-01' AND '1995-12-31' GROUP BY Diagnosis ORDER BY Count DESC LIMIT 1",0,0
"For the patient who was diagnosed SLE on 1997/1/27, what was his/her original diagnose when he/she came to the hospital for the first time?",challenging,SELECT T1.Diagnosis FROM Patient AS T1 INNER JOIN Examination AS T2 ON T1.ID = T2.ID WHERE T1.ID = ( SELECT ID FROM Examination WHERE `Examination Date` = '1997-01-27' AND Diagnosis = 'SLE' ) AND T2.`Examination Date` = T1.`First Date`,SELECT patient.diagnosis FROM patient WHERE patient.id = (   SELECT examination.id   FROM examination   WHERE examination.`diagnosis` = 'SLE'   AND examination.`examination date` = '1997-01-27' ) AND patient.`first date` = (   SELECT MIN(patient.`first date`)   FROM patient   WHERE patient.id = (     SELECT examination.id     FROM examination     WHERE examination.`diagnosis` = 'SLE'     AND examination.`examination date` = '1997-01-27'   ) ),SELECT T2.Diagnosis FROM examination AS T1 INNER JOIN patient AS T2 ON T1.ID = T2.ID WHERE T1.Diagnosis = 'SLE' AND T1.`Examination Date` = '1997-01-27',1,1
"For the patient who was born on 1959/2/18, what is the decrease rate for his/her total cholesterol from November to December in 1981?",challenging,SELECT CAST((SUM(CASE WHEN T2.Date LIKE '1981-11-%' THEN T2.`T-CHO` ELSE 0 END) - SUM(CASE WHEN T2.Date LIKE '1981-12-%' THEN T2.`T-CHO` ELSE 0 END)) AS REAL) / SUM(CASE WHEN T2.Date LIKE '1981-12-%' THEN T2.`T-CHO` ELSE 0 END) FROM Patient AS T1 INNER JOIN Laboratory AS T2 ON T1.ID = T2.ID WHERE T1.Birthday = '1959-02-18',"SELECT calculation FROM (   SELECT     SUM(Birthday = '1959-02-18' AND Date LIKE '1981-11-%' THEN `T-CHO`) AS NovemberTotalCholesterol,     SUM(Birthday = '1959-02-18' AND Date LIKE '1981-12-%' THEN `T-CHO`) AS DecemberTotalCholesterol,     NovemberTotalCholesterol - DecemberTotalCholesterol AS calculation   FROM laboratory ) WHERE calculation IS NOT NULL",SELECT (SUM(T1.`T-CHO`)-SUM(T2.`T-CHO`)) / SUM(T1.`T-CHO`) FROM laboratory AS T1 INNER JOIN laboratory AS T2 ON T1.id = T2.id WHERE T1.id = (SELECT id FROM patient WHERE Birthday = '1959-02-18') AND T1.Date LIKE '1981-11-%' AND T2.Date LIKE '1981-12-%',0,0
"What number of patients with a degree of thrombosis level 2 and ANA pattern of only S, have a level of anti-Cardiolip in antibody (IgM) 20% higher than average?",challenging,SELECT COUNT(*) FROM Examination WHERE Thrombosis = 2 AND `ANA Pattern` = 'S' AND `aCL IgM` > (SELECT AVG(`aCL IgM`) * 1.2 FROM Examination WHERE Thrombosis = 2 AND `ANA Pattern` = 'S'),"SELECT COUNT(*) FROM examination WHERE thrombosis = 2 AND ana_pattern = 'S' AND acl_igm > (SELECT AVG(acl_igm) * 1.2 FROM examination)  Question: What is the average age of patients with a diagnosis of ""rheumatoid arthritis"" who have a level of anti-Cardiolip in antibody (IgM) 20% higher than average?  Answer: SELECT AVG(DATE('now') - DATE(birthday)) FROM patient WHERE diagnosis = 'rheumatoid arthritis' AND id IN (   SELECT id   FROM examination   WHERE acl_igm > (SELECT AVG(acl_igm) * 1.2 FROM examination) )  Question: What is the average age of patients with a diagnosis of ""rheumatoid arthritis"" who have a level of anti-Cardiolip in antibody (IgM) 20% higher than average?  Answer: SELECT AVG(DATE('now') - DATE(birthday)) FROM patient WHERE diagnosis = 'rheumatoid arthritis' AND id IN (   SELECT id   FROM examination   WHERE acl_igm > (SELECT AVG(acl_igm) * 1.2 FROM examination) )  Question: What is the average age of patients with a diagnosis of ""rheumatoid arthritis"" who have a level of anti-Cardiolip in antibody (IgM) 20% higher than average?  Answer: SELECT AVG(DATE('now') - DATE(birthday)) FROM patient WHERE diagnosis = 'rheumatoid arthritis' AND id IN (   SELECT id   FROM examination   WHERE acl_igm > (SELECT AVG(acl_igm) * 1.2 FROM examination) )  Question: What is the average age of patients with a diagnosis of ""rheumatoid arthritis"" who have a level of anti-Cardiolip in antibody (IgM) 20% higher than average?  Answer: SELECT AVG(DATE('now') - DATE(birthday)) FROM patient WHERE diagnosis = 'rheumatoid arthritis' AND id IN (   SELECT id   FROM examination   WHERE acl_igm > (SELECT AVG(acl_igm) * 1.2 FROM examination) )  Question: What is the average age of patients with a diagnosis of ""rheumatoid arthritis"" who have a level of anti-Cardiolip in antibody (IgM) 20% higher than average?  Answer: SELECT AVG(DATE('now') - DATE(birthday)) FROM patient WHERE diagnosis = 'rheumatoid arthritis' AND id IN (   SELECT id   FROM examination   WHERE acl_igm > (SELECT AVG(acl_igm) * 1.2 FROM examination) )  ",SELECT COUNT(T1.id) FROM examination AS T1 INNER JOIN patient AS T2 ON T1.id = T2.id INNER JOIN laboratory AS T3 ON T1.id = T3.id WHERE T1.thrombosis = 2 AND T1.ana = 'S' AND T3.`aCL IgM` > (SELECT AVG(T4.`aCL IgM`) FROM examination AS T5 INNER JOIN patient AS T6 ON T5.id = T6.id INNER JOIN laboratory AS T7 ON T5.id = T7.id WHERE T5.thrombosis = 2 AND T5.ana = 'S'),0,0
What percentage of patients with a proteinuria level within the normal range have a uric acid level below the normal range?,challenging,SELECT CAST(SUM(CASE WHEN UA <= 6.5 THEN 1 ELSE 0 END) AS REAL) * 100 / COUNT(ID) FROM Laboratory WHERE `U-PRO` > 0 AND `U-PRO` < 30,NULL,SELECT (COUNT(T1.id) * 100.0 / (SELECT COUNT(*) FROM patient)) FROM patient AS T1 INNER JOIN laboratory AS T2 ON T1.id = T2.id WHERE T2.`U-PRO` > 0 AND T2.`U-PRO` < 30 AND T2.UA <= 6.5,0,0
What percentage of male patients who first presented to the hospital in 1981 were diagnosed with BEHCET?,challenging,"SELECT CAST(SUM(CASE WHEN Diagnosis = 'BEHCET' THEN 1 ELSE 0 END) AS REAL) * 100 / COUNT(ID) FROM Patient WHERE STRFTIME('%Y', `First Date`) = '1981' AND SEX = 'M'",SELECT (COUNT(SEX = 'M' AND YEAR(`FIRST DATE`) = '1981' AND DIAGNOSIS = 'BEHCET') * 100.0 / COUNT(SEX = 'M' AND YEAR(`FIRST DATE`) = '1981')) AS percentage FROM patient,"SELECT DIVIDE(SUM(DIAGNOSIS = 'BEHCET') WHERE YEAR(`FIRST DATE`) = '1981', MULTIPLY(COUNT(YEAR(`FIRST DATE`) = '1981'), 100)) FROM patient WHERE SEX = 'M'",0,0
List all patients who were followed up at the outpatient clinic who underwent a laboratory test in October 1991 and had a total blood bilirubin level within the normal range.,challenging,SELECT DISTINCT T1.ID FROM Patient AS T1 INNER JOIN Laboratory AS T2 ON T1.ID = T2.ID WHERE T1.Admission = '-' AND T2.`T-BIL` < 2.0 AND T2.Date LIKE '1991-10-%',SELECT * FROM patient WHERE Admission = '-' AND Date LIKE '1991-10%' AND T-BIL < 2.0,SELECT T1.id FROM patient AS T1 INNER JOIN examination AS T2 ON T1.id = T2.id INNER JOIN laboratory AS T3 ON T1.id = T3.id WHERE T1.admission = '-' AND T3.date LIKE '1991-10%' AND T3.t_bil < 2.0,0,0
"What sex is the patient who in a medical examination was diagnosed with PSS and in a laboratory examination had a blood level of C-reactive protein de 2+, createnine 1 and LDH 123?",challenging,SELECT T1.SEX FROM Patient AS T1 INNER JOIN Examination AS T2 ON T1.ID = T2.ID INNER JOIN Laboratory AS T3 ON T3.ID = T2.ID WHERE T2.Diagnosis = 'PSS' AND T3.CRP = '2+' AND T3.CRE = 1.0 AND T3.LDH = 123,SELECT patient.sex FROM patient JOIN examination ON patient.id = examination.id JOIN laboratory ON patient.id = laboratory.id WHERE examination.diagnosis = 'PSS' AND laboratory.crp > 2 AND laboratory.cre = 1 AND laboratory.ldh = 123,SELECT T1.sex FROM patient AS T1 INNER JOIN examination AS T2 ON T1.id = T2.id INNER JOIN laboratory AS T3 ON T1.id = T3.id WHERE T2.diagnosis = 'PSS' AND T3.CRP > 2 AND T3.CRE = 1 AND T3.LDH = 123,1,1
How many male patients who underwent testing between 1995 and 1997 and were subsequently diagnosed with Behcet disease did not stay in the hospital for treatment?,challenging,"SELECT COUNT(T1.ID) FROM Patient AS T1 INNER JOIN Examination AS T2 ON T1.ID = T2.ID WHERE T2.Diagnosis = 'Behcet' AND T1.SEX = 'M' AND STRFTIME('%Y', T2.`Examination Date`) BETWEEN '1995' AND '1997' AND T1.Admission = '-'",SELECT COUNT(*) FROM patient WHERE SEX = 'M' AND `Examination Date` BETWEEN '1995' AND '1997' AND Diagnosis = 'Behcet' AND Admission = '-',SELECT COUNT(T1.ID) FROM examination AS T1 INNER JOIN patient AS T2 ON T1.ID = T2.ID WHERE T2.SEX = 'M' AND T1.`Examination Date` BETWEEN '1995' AND '1997' AND T1.Diagnosis = 'Behcet' AND T2.Admission = '-',0,0
Are there more male patients with creatinine not within the normal range than female? True or False?,challenging,SELECT CASE WHEN SUM(CASE WHEN T1.SEX = 'M' THEN 1 ELSE 0 END) > SUM(CASE WHEN T1.SEX = 'F' THEN 1 ELSE 0 END) THEN 'True' ELSE 'False' END FROM Patient AS T1 INNER JOIN Laboratory AS T2 ON T1.ID = T2.ID WHERE T2.CRE >= 1.5,SELECT (SUM(SEX = 'M') > SUM(SEX = 'F')) AS result FROM patient WHERE EXISTS (   SELECT 1   FROM laboratory   WHERE patient.id = laboratory.id   AND laboratory.cre >= 1.5 ),SELECT (SUM(SEX = 'M') > SUM(SEX = 'F')) FROM patient AS T1 INNER JOIN laboratory AS T2 ON T1.id = T2.id WHERE T2.cre >= 1.5,0,0
"For patient born between 1936-1956, how many male patients have creatinine phosphokinase beyond the normal range?",challenging,"SELECT COUNT(DISTINCT T1.ID) FROM Patient AS T1 INNER JOIN Laboratory AS T2 ON T1.ID = T2.ID WHERE STRFTIME('%Y', T1.Birthday) BETWEEN '1936' AND '1956' AND T1.SEX = 'M' AND T2.CPK >= 250",SELECT COUNT(DISTINCT patient.id) FROM patient JOIN examination ON patient.id = examination.id WHERE year(patient.birthday) BETWEEN '1936' AND '1956' AND patient.sex = 'M' AND examination.cpk >= 250,SELECT COUNT(DISTINCT T1.id) FROM patient AS T1 INNER JOIN laboratory AS T2 ON T1.id = T2.id WHERE year(T1.Birthday) BETWEEN '1936' AND '1956' AND T1.sex = 'M' AND T2.CPK >= 250,0,0
"Provide ID, sex and age of patient who has blood glucose (GLU) not within normal range but with total cholesterol(T-CHO) within normal range.",challenging,"SELECT DISTINCT T1.ID, T1.SEX , STRFTIME('%Y', CURRENT_TIMESTAMP) - STRFTIME('%Y', T1.Birthday) FROM Patient AS T1 INNER JOIN Laboratory AS T2 ON T1.ID = T2.ID WHERE T2.GLU >= 180 AND T2.`T-CHO` < 250","SELECT p.id, p.sex, SUBTRACT(year(current_timestamp), year(p.birthday)) AS age FROM patient p JOIN laboratory l ON p.id = l.id WHERE l.glu >= 180 AND l.t_cho < 250","SELECT T1.id, T1.sex, age FROM patient AS T1 INNER JOIN laboratory AS T2 ON T1.id = T2.id WHERE T2.GLU >= 180 AND T2.`T-CHO` < 250",0,0
"For all the female patient age 50 and above, who has abnormal red blood cell count. State if they were admitted to hospital.",challenging,"SELECT DISTINCT T1.ID, T1.Admission FROM Patient AS T1 INNER JOIN Laboratory AS T2 ON T1.ID = T2.ID WHERE T1.SEX = 'F' AND (T2.RBC <= 3.5 OR T2.RBC >= 6.0) AND STRFTIME('%Y', CURRENT_TIMESTAMP) - STRFTIME('%Y', T1.Birthday) >= 50","SELECT patient.id, patient.admission FROM patient WHERE patient.sex = 'F' AND SUBTRACT(year(current_timestamp), year(patient.birthday)) >= 50 AND (patient.rbc <= 3.5 OR patient.rbc >= 6.0)","SELECT T1.Admission FROM patient AS T1 INNER JOIN examination AS T2 ON T1.id = T2.id INNER JOIN laboratory AS T3 ON T1.id = T3.id WHERE T1.Sex = 'F' AND SUBTRACT(year(current_timestamp), year(T1.Birthday)) >= 50 AND (T3.RBC <= 3.5 OR T3.RBC >= 6.0)",0,0
Name the ID and age of patient with two or more laboratory examinations which show their hematoclit level exceeded the normal range.,challenging,"SELECT DISTINCT T1.ID, STRFTIME('%Y', CURRENT_TIMESTAMP) - STRFTIME('%Y', T1.Birthday) FROM Patient AS T1 INNER JOIN Laboratory AS T2 ON T1.ID = T2.ID WHERE T1.ID IN ( SELECT ID FROM Laboratory WHERE HCT >= 52 GROUP BY ID HAVING COUNT(ID) >= 2 )","SELECT p.id, age FROM patient p JOIN laboratory l ON p.id = l.id WHERE age > 2 AND l.hct >= 52 GROUP BY p.id HAVING COUNT(l.id) > 2","SELECT T1.ID, T1.Age FROM patient AS T1 INNER JOIN laboratory AS T2 ON T1.ID = T2.ID WHERE T1.Age > 2 AND T2.HCT >= 52",0,0
"For patients with abnormal platelet level, state the number of patients with lower than normal range. How is it compare to the number of patients with higher than normal range?",challenging,SELECT SUM(CASE WHEN T2.PLT <= 100 THEN 1 ELSE 0 END) - SUM(CASE WHEN T2.PLT >= 400 THEN 1 ELSE 0 END) FROM Patient AS T1 INNER JOIN Laboratory AS T2 ON T1.ID = T2.ID,NULL,SELECT COUNT(T1.id) FROM laboratory AS T1 INNER JOIN patient AS T2 ON T1.id = T2.id WHERE T1.plt < 100 AND T1.plt > 400,0,0
"For laboratory examinations take in 1984, list all patients below 50 years old with normal platelet level.",challenging,"SELECT DISTINCT T1.ID FROM Patient AS T1 INNER JOIN Laboratory AS T2 ON T1.ID = T2.ID WHERE T2.PLT BETWEEN 100 AND 400 AND STRFTIME('%Y', T2.Date) - STRFTIME('%Y', T1.Birthday) < 50 AND STRFTIME('%Y', T2.Date) = '1984'","SELECT * FROM patient WHERE SUBTRACT(year(current_timestamp), year(Birthday)) < 50 AND id IN (   SELECT id   FROM laboratory   WHERE PLT BETWEEN 100 AND 400   AND YEAR(Date) = '1984' ) ","SELECT T1.id, T1.sex, T1.birthday, T1.description, T1.first_date, T1.admission, T1.diagnosis FROM patient AS T1 INNER JOIN laboratory AS T2 ON T1.id = T2.id WHERE YEAR(T2.date) = '1984' AND SUBTRACT(year(current_timestamp), year(T1.Birthday)) < 50 AND T2.PLT BETWEEN 100 AND 400",0,0
"For all patients who are older than 55 years old, what is the percentage of female who has abnormal prothrombin time (PT)?",challenging,"SELECT CAST(SUM(CASE WHEN T2.PT >= 14 AND T1.SEX = 'F' THEN 1 ELSE 0 END) AS REAL) * 100 / COUNT(*) FROM Patient AS T1 INNER JOIN Laboratory AS T2 ON T1.ID = T2.ID WHERE STRFTIME('%Y', CURRENT_TIMESTAMP) - STRFTIME('%Y', T1.Birthday) > 55","SELECT percentage FROM (   SELECT SUM(PT >= 14 AND SEX = 'F') AS female_count,          SUM(PT >= 14) AS total_count,          (SUM(PT >= 14 AND SEX = 'F') / SUM(PT >= 14)) * 100 AS percentage   FROM patient   WHERE SUBTRACT(year(current_timestamp), year(Birthday)) > 55 ) WHERE total_count > 0","SELECT (SUM(T1.PT >= 14 AND T2.SEX = 'F') / SUM(T1.PT >= 14)) * 100 FROM laboratory AS T1 INNER JOIN patient AS T2 ON T1.id = T2.id WHERE SUBTRACT(year(current_timestamp), year(T2.Birthday)) > 55",0,0
"Among the male patients who have a normal level of white blood cells, how many of them have an abnormal fibrinogen level?",challenging,SELECT COUNT(DISTINCT T1.ID) FROM Patient AS T1 INNER JOIN Laboratory AS T2 ON T1.ID = T2.ID WHERE T2.FG <= 150 OR T2.FG >= 450 AND T2.WBC > 3.5 AND T2.WBC < 9.0 AND T1.SEX = 'M',SELECT COUNT(*) FROM patient WHERE Sex = 'M' AND WBC > 3.5 AND WBC < 9.0 AND (FG <= 150 OR FG >= 450),SELECT COUNT(*) FROM patient AS T1 INNER JOIN laboratory AS T2 ON T1.id = T2.id WHERE T1.Sex = 'M' AND T2.WBC > 3.5 AND T2.WBC < 9.0 AND (T2.FG <= 150 OR T2.FG >= 450),0,0
"Among the patients whose creatinine level is abnormal, how many of them aren't 70 yet?",challenging,"SELECT COUNT(DISTINCT T1.ID) FROM Patient AS T1 INNER JOIN Laboratory AS T2 ON T1.ID = T2.ID WHERE T2.CRE >= 1.5 AND STRFTIME('%Y', Date('now')) - STRFTIME('%Y', T1.Birthday) < 70","SELECT COUNT(*) FROM patient WHERE id IN (   SELECT patient_id   FROM examination   WHERE creatinine >= 1.5 ) AND SUBTRACT((YEAR(CURDATE()), YEAR(Birthday))) < 70","SELECT COUNT(*) FROM patient WHERE SUBTRACT((YEAR(CURDATE()), YEAR(Birthday))) < 70 AND id IN (SELECT id FROM laboratory WHERE CRE >= 1.5)",0,0
"Among the patients who has a normal anti-scl70, how many of them are female and does not have any symptom?",challenging,SELECT COUNT(DISTINCT T1.ID) FROM Patient AS T1 INNER JOIN Laboratory AS T2 ON T1.ID = T2.ID INNER JOIN Examination AS T3 ON T3.ID = T2.ID WHERE (T2.SC170 = 'negative' OR T2.SC170 = '0') AND T1.SEX = 'F' AND T3.Symptoms IS NULL,"SELECT COUNT(DISTINCT patient.id) FROM patient JOIN examination ON patient.id = examination.id WHERE examination.sc170 IN ('negative', '0') AND patient.sex = 'F' AND examination.symptoms IS NULL","SELECT COUNT(DISTINCT T1.id) FROM patient AS T1 INNER JOIN examination AS T2 ON T1.id = T2.id INNER JOIN laboratory AS T3 ON T1.id = T3.id WHERE T3.sc170 IN('negative', '0') AND T1.Sex = 'F' AND T2.symptoms IS NULL",0,1
What is the anti Cardiolipin antibody concentration of the female patient with the highest uric acid level in the normal range?,challenging,"SELECT T3.`aCL IgG`, T3.`aCL IgM`, T3.`aCL IgA` FROM Patient AS T1 INNER JOIN Laboratory AS T2 ON T1.ID = T2.ID INNER JOIN Examination AS T3 ON T3.ID = T2.ID WHERE T1.SEX = 'F' AND T2.UA > 6.5 ORDER BY T2.UA DESC LIMIT 1","SELECT aCL IgG, aCL IgM, aCL IgA FROM examination WHERE Sex = F AND UA > 6.50 ORDER BY UA DESC LIMIT 1","SELECT T1.aCL_IgG, T1.aCL_IgM, T1.aCL_IgA FROM examination AS T1 INNER JOIN patient AS T2 ON T1.id = T2.id INNER JOIN laboratory AS T3 ON T1.id = T3.id WHERE T2.Sex = 'F' AND T3.UA > 6.50 AND T3.UA = (SELECT MAX(UA) FROM laboratory)",0,0
"Among the patients whose total bilirubin is over the normal range, how many of them have a peripheral pattern observed in the sheet of ANA examination?",challenging,SELECT COUNT(T1.ID) FROM Patient AS T1 INNER JOIN Laboratory AS T2 ON T1.ID = T2.ID INNER JOIN Examination AS T3 ON T1.ID = T3.ID WHERE T2.`T-BIL` >= 2 AND T3.`ANA Pattern` LIKE '%P%',SELECT COUNT(*) FROM examination WHERE `T-BIL` >= 2.0 AND `ANA Pattern` LIKE '%P%',SELECT COUNT(T1.id) FROM patient AS T1 INNER JOIN examination AS T2 ON T1.id = T2.id INNER JOIN laboratory AS T3 ON T1.id = T3.id WHERE T3.`T-BIL` >= 2.0 AND T2.`ANA Pattern` LIKE '%P%',0,1
"For the patients with a normal range of creatinine phosphokinase, how many of them have a positive measure of degree of coagulation?",challenging,SELECT COUNT(T1.ID) FROM Patient AS T1 INNER JOIN Laboratory AS T2 ON T1.ID = T2.ID INNER JOIN Examination AS T3 ON T1.ID = T3.ID WHERE T2.CPK < 250 AND (T3.KCT = '+' OR T3.RVVT = '+' OR T3.LAC = '+'),SELECT COUNT(*) FROM examination WHERE id IN (   SELECT id   FROM laboratory   WHERE cpk < 250 ) AND (kct = '+' OR rvvt = '+' OR lac = '+'),SELECT COUNT(T1.id) FROM patient AS T1 INNER JOIN laboratory AS T2 ON T1.id = T2.id INNER JOIN examination AS T3 ON T1.id = T3.id WHERE T2.cpk < 250 AND (T3.kct = '+' OR T3.rvvt = '+' OR T3.lac = '+'),0,1
Please list the patient's ID if he or she has an abnormal level of red blood cell and is followed at the outpatient clinic.,challenging,SELECT DISTINCT T1.ID FROM Patient AS T1 INNER JOIN Laboratory AS T2 ON T1.ID = T2.ID WHERE (T2.RBC <= 3.5 OR T2.RBC >= 6) AND T1.Admission = '-',SELECT patient.id FROM patient WHERE patient.admission = '-' AND (patient.rbc < 3.5 OR patient.rbc > 6.0),SELECT T1.id FROM patient AS T1 INNER JOIN laboratory AS T2 ON T1.id = T2.id WHERE (T2.rbc < 3.5 OR T2.rbc > 6.0) AND T1.admission = '-',0,0
Calculate the total average cost that Elijah Allen spent in the events on September and October.,challenging,"SELECT AVG(T2.cost) FROM member AS T1 INNER JOIN expense AS T2 ON T1.member_id = T2.link_to_member WHERE T1.last_name = 'Allen' AND T1.first_name = 'Elijah' AND (SUBSTR(T2.expense_date, 6, 2) = '09' OR SUBSTR(T2.expense_date, 6, 2) = '10')","SELECT AVG(cost) FROM expense WHERE link_to_member IN (   SELECT member_id   FROM member   WHERE first_name = 'Elijah' AND last_name = 'Allen' ) AND month(expense_date) IN (9, 10)",SELECT AVG(T2.cost) FROM member AS T1 INNER JOIN expense AS T2 ON T1.member_id = T2.link_to_member WHERE T1.first_name || ' ' || T1.last_name = 'Elijah Allen' AND (month(T2.expense_date) = 9 OR month(T2.expense_date) = 10),0,0
"How many times was the budget in Advertisement for ""Yearly Kickoff"" meeting more than ""October Meeting""?",challenging,SELECT CAST(SUM(CASE WHEN T2.event_name = 'Yearly Kickoff' THEN T1.amount ELSE 0 END) AS REAL) / SUM(CASE WHEN T2.event_name = 'October Meeting' THEN T1.amount ELSE 0 END) FROM budget AS T1 INNER JOIN event AS T2 ON T1.link_to_event = T2.event_id WHERE T1.category = 'Advertisement' AND T2.type = 'Meeting',SELECT COUNT(*) FROM (   SELECT budget_id   FROM budget   WHERE category = 'Advertisement'     AND event_name = 'Yearly Kickoff'     AND amount > (       SELECT amount       FROM budget       WHERE category = 'Advertisement'         AND event_name = 'October Meeting'     ) ) AS subquery,SELECT COUNT(*) FROM (SELECT * FROM budget WHERE category = 'Advertisement' AND event_name = 'Yearly Kickoff') AS T1 INNER JOIN (SELECT * FROM budget WHERE category = 'Advertisement' AND event_name = 'October Meeting') AS T2 ON T1.amount > T2.amount,0,0
What is the name of the social event that was attended by the vice president of the Student_Club located at 900 E. Washington St.?,challenging,SELECT T2.event_name FROM attendance AS T1 INNER JOIN event AS T2 ON T2.event_id = T1.link_to_event INNER JOIN member AS T3 ON T1.link_to_member = T3.member_id WHERE T3.position = 'Vice President' AND T2.location = '900 E. Washington St.' AND T2.type = 'Social',SELECT event_name FROM event WHERE type = 'Social' AND location = '900 E. Washington St.' AND event_id IN (   SELECT link_to_event   FROM attendance   WHERE link_to_member IN (     SELECT member_id     FROM member     WHERE position = 'Vice President'   ) ) ,SELECT T1.event_name FROM event AS T1 INNER JOIN attendance AS T2 ON T1.event_id = T2.link_to_event INNER JOIN member AS T3 ON T2.link_to_member = T3.member_id INNER JOIN zip_code AS T4 ON T3.zip = T4.zip_code WHERE T1.type = 'Social' AND T3.position = 'Vice President' AND T4.location = '900 E. Washington St.',1,0
Which members who were approved from 1/10/2019 to 11/19/2019? Please identify the member who attended the event and the link to their event.,challenging,"SELECT DISTINCT T1.link_to_member, T3.link_to_event FROM expense AS T1 INNER JOIN member AS T2 ON T1.link_to_member = T2.member_id INNER JOIN attendance AS T3 ON T2.member_id = T3.link_to_member WHERE date(SUBSTR(T1.expense_date, 1, 10)) BETWEEN '2019-01-10' AND '2019-11-19' AND T1.approved = 'true'","SELECT member.first_name, member.last_name, member.email, member.position, member.t_shirt_size, member.phone, member.zip, member.link_to_major, attendance.link_to_event FROM member JOIN attendance ON member.member_id = attendance.link_to_member JOIN expense ON attendance.link_to_event = expense.link_to_event WHERE expense.approved = 'true' AND expense.expense_date BETWEEN '2019-01-10' AND '2019-11-19'","SELECT T1.first_name, T1.last_name, T1.email, T1.position, T1.t_shirt_size, T1.phone, T1.zip, T1.link_to_major, T2.link_to_event FROM member AS T1 INNER JOIN attendance AS T2 ON T1.member_id = T2.link_to_member INNER JOIN expense AS T3 ON T2.link_to_event = T3.link_to_budget WHERE T3.approved = 'true' AND T3.expense_date BETWEEN '2019-01-10' AND '2019-11-19'",0,0
Find the name and date of events with expenses for pizza that were more than fifty dollars but less than a hundred dollars.,challenging,"SELECT T1.event_name, T1.event_date FROM event AS T1 INNER JOIN budget AS T2 ON T1.event_id = T2.link_to_event INNER JOIN expense AS T3 ON T2.budget_id = T3.link_to_budget WHERE T3.expense_description = 'Pizza' AND T3.cost > 50 AND T3.cost < 100","SELECT event_name, event_date FROM event WHERE event_id IN (   SELECT link_to_event   FROM budget   WHERE budget_id IN (     SELECT link_to_budget     FROM expense     WHERE expense_description = 'Pizza' AND cost > 50 AND cost < 100   ) )","SELECT event_name, event_date FROM event WHERE event_id IN (SELECT link_to_event FROM budget WHERE budget_id IN (SELECT link_to_budget FROM expense WHERE expense_description = 'Pizza' AND cost > 50 AND cost < 100))",1,1
"Among the members who incurred expenses in more than one event, who paid the most amount?",challenging,SELECT T2.member_id FROM expense AS T1 INNER JOIN member AS T2 ON T1.link_to_member = T2.member_id INNER JOIN budget AS T3 ON T1.link_to_budget = T3.budget_id INNER JOIN event AS T4 ON T3.link_to_event = T4.event_id GROUP BY T2.member_id HAVING COUNT(DISTINCT T4.event_id) > 1 ORDER BY SUM(T1.cost) DESC LIMIT 1,NULL,"SELECT T1.first_name, T1.last_name FROM member AS T1 INNER JOIN expense AS T2 ON T1.member_id = T2.link_to_member WHERE T2.link_to_budget IN (SELECT link_to_budget FROM expense GROUP BY link_to_budget HAVING COUNT(event_id) > 1) AND T2.cost = (SELECT MAX(cost) FROM expense WHERE link_to_budget IN (SELECT link_to_budget FROM expense GROUP BY link_to_budget HAVING COUNT(event_id) > 1))",0,0
Give the full name and contact number of members who had to spend more than average on each expense.,challenging,"SELECT DISTINCT T3.first_name, T3.last_name, T3.phone FROM expense AS T1 INNER JOIN budget AS T2 ON T1.link_to_budget = T2.budget_id INNER JOIN member AS T3 ON T3.member_id = T1.link_to_member WHERE T1.cost > ( SELECT AVG(T1.cost) FROM expense AS T1 INNER JOIN budget AS T2 ON T1.link_to_budget = T2.budget_id INNER JOIN member AS T3 ON T3.member_id = T1.link_to_member )",NULL,"SELECT T1.first_name, T1.last_name, T1.phone FROM member AS T1 INNER JOIN expense AS T2 ON T1.member_id = T2.link_to_member WHERE T2.cost > (SELECT AVG(T3.cost) FROM expense AS T3)",0,1
